{
  "schemaVersion": 1,
  "registryId": "bleach-manga-cut-video-ids",
  "seriesId": "bleach-manga-cut",
  "policy": {
    "appendOnly": true,
    "registryPresenceImpliesPublication": false,
    "identifiersDependOnPlacement": false,
    "decimalEncoding": "lexical-p-delimiter",
    "decimalSyntaxImpliesEditorialKind": false,
    "unknownSyntax": "validation-error"
  },
  "entries": [
    {"recordType":"normalized-record","recordId":"concentrated:01","projectId":"concentrated","sourceIdentifier":"01","videoId":"cb_1","status":"published","locked":true},
    {"recordType":"normalized-record","recordId":"concentrated:02","projectId":"concentrated","sourceIdentifier":"02","videoId":"cb_2","status":"published","locked":true},
    {"recordType":"normalized-record","recordId":"concentrated:03","projectId":"concentrated","sourceIdentifier":"03","videoId":"cb_3","status":"published","locked":true},
    {"recordType":"normalized-record","recordId":"concentrated:04","projectId":"concentrated","sourceIdentifier":"04","videoId":"cb_4","status":"published","locked":true},
    {"recordType":"normalized-record","recordId":"concentrated:05","projectId":"concentrated","sourceIdentifier":"05","videoId":"cb_5","status":"published","locked":true},
    {"recordType":"normalized-record","recordId":"concentrated:06","projectId":"concentrated","sourceIdentifier":"06","videoId":"cb_6","status":"published","locked":true},
    {"recordType":"normalized-record","recordId":"concentrated:07","projectId":"concentrated","sourceIdentifier":"07","videoId":"cb_7","status":"published","locked":true},
    {"recordType":"normalized-record","recordId":"concentrated:08","projectId":"concentrated","sourceIdentifier":"08","videoId":"cb_8","status":"published","locked":true},
    {"recordType":"normalized-record","recordId":"concentrated:09","projectId":"concentrated","sourceIdentifier":"09","videoId":"cb_9","status":"published","locked":true},
    {"recordType":"normalized-record","recordId":"concentrated:10","projectId":"concentrated","sourceIdentifier":"10","videoId":"cb_10","status":"published","locked":true},
    {"recordType":"normalized-record","recordId":"concentrated:11","projectId":"concentrated","sourceIdentifier":"11","videoId":"cb_11","status":"published","locked":true},
    {"recordType":"normalized-record","recordId":"concentrated:12","projectId":"concentrated","sourceIdentifier":"12","videoId":"cb_12","status":"published","locked":true},
    {"recordType":"normalized-record","recordId":"concentrated:13","projectId":"concentrated","sourceIdentifier":"13","videoId":"cb_13","status":"published","locked":true},
    {"recordType":"normalized-record","recordId":"concentrated:14","projectId":"concentrated","sourceIdentifier":"14","videoId":"cb_14","status":"published","locked":true},
    {"recordType":"normalized-record","recordId":"concentrated:15","projectId":"concentrated","sourceIdentifier":"15","videoId":"cb_15","status":"published","locked":true},
    {"recordType":"normalized-record","recordId":"concentrated:16","projectId":"concentrated","sourceIdentifier":"16","videoId":"cb_16","status":"published","locked":true},
    {"recordType":"normalized-record","recordId":"concentrated:17","projectId":"concentrated","sourceIdentifier":"17","videoId":"cb_17","status":"published","locked":true},
    {"recordType":"normalized-record","recordId":"concentrated:18","projectId":"concentrated","sourceIdentifier":"18","videoId":"cb_18","status":"published","locked":true},
    {"recordType":"normalized-record","recordId":"concentrated:19","projectId":"concentrated","sourceIdentifier":"19","videoId":"cb_19","status":"published","locked":true},
    {"recordType":"normalized-record","recordId":"concentrated:20","projectId":"concentrated","sourceIdentifier":"20","videoId":"cb_20","status":"published","locked":true},
    {"recordType":"normalized-record","recordId":"concentrated:21","projectId":"concentrated","sourceIdentifier":"21","videoId":"cb_21","status":"published","locked":true},
    {"recordType":"normalized-record","recordId":"concentrated:22","projectId":"concentrated","sourceIdentifier":"22","videoId":"cb_22","status":"published","locked":true},
    {"recordType":"normalized-record","recordId":"concentrated:23","projectId":"concentrated","sourceIdentifier":"23","videoId":"cb_23","status":"published","locked":true},
    {"recordType":"normalized-record","recordId":"concentrated:24","projectId":"concentrated","sourceIdentifier":"24","videoId":"cb_24","status":"published","locked":true},
    {"recordType":"normalized-record","recordId":"concentrated:25","projectId":"concentrated","sourceIdentifier":"25","videoId":"cb_25","status":"published","locked":true},
    {"recordType":"normalized-record","recordId":"concentrated:26","projectId":"concentrated","sourceIdentifier":"26","videoId":"cb_26","status":"published","locked":true},
    {"recordType":"normalized-record","recordId":"concentrated:27","projectId":"concentrated","sourceIdentifier":"27","videoId":"cb_27","status":"published","locked":true},
    {"recordType":"normalized-record","recordId":"concentrated:27.5","projectId":"concentrated","sourceIdentifier":"27.5","videoId":"cb_27p5","status":"published","locked":true},
    {"recordType":"normalized-record","recordId":"concentrated:28","projectId":"concentrated","sourceIdentifier":"28","videoId":"cb_28","status":"published","locked":true},
    {"recordType":"normalized-record","recordId":"concentrated:29","projectId":"concentrated","sourceIdentifier":"29","videoId":"cb_29","status":"published","locked":true},
    {"recordType":"normalized-record","recordId":"concentrated:30","projectId":"concentrated","sourceIdentifier":"30","videoId":"cb_30","status":"published","locked":true},
    {"recordType":"normalized-record","recordId":"concentrated:31","projectId":"concentrated","sourceIdentifier":"31","videoId":"cb_31","status":"published","locked":true},
    {"recordType":"normalized-record","recordId":"concentrated:32","projectId":"concentrated","sourceIdentifier":"32","videoId":"cb_32","status":"published","locked":true},
    {"recordType":"normalized-record","recordId":"concentrated:33","projectId":"concentrated","sourceIdentifier":"33","videoId":"cb_33","status":"published","locked":true},
    {"recordType":"normalized-record","recordId":"concentrated:34","projectId":"concentrated","sourceIdentifier":"34","videoId":"cb_34","status":"published","locked":true},
    {"recordType":"normalized-record","recordId":"concentrated:35","projectId":"concentrated","sourceIdentifier":"35","videoId":"cb_35","status":"published","locked":true},
    {"recordType":"normalized-record","recordId":"concentrated:0.0","projectId":"concentrated","sourceIdentifier":"0.0","videoId":"cb_0p0","status":"published","locked":true},
    {"recordType":"normalized-record","recordId":"concentrated:36","projectId":"concentrated","sourceIdentifier":"36","videoId":"cb_36","status":"published","locked":true},
    {"recordType":"normalized-record","recordId":"concentrated:37","projectId":"concentrated","sourceIdentifier":"37","videoId":"cb_37","status":"published","locked":true},
    {"recordType":"normalized-record","recordId":"concentrated:38","projectId":"concentrated","sourceIdentifier":"38","videoId":"cb_38","status":"published","locked":true},
    {"recordType":"normalized-record","recordId":"concentrated:39","projectId":"concentrated","sourceIdentifier":"39","videoId":"cb_39","status":"published","locked":true},
    {"recordType":"normalized-record","recordId":"concentrated:40","projectId":"concentrated","sourceIdentifier":"40","videoId":"cb_40","status":"published","locked":true},
    {"recordType":"normalized-record","recordId":"concentrated:41","projectId":"concentrated","sourceIdentifier":"41","videoId":"cb_41","status":"published","locked":true},
    {"recordType":"normalized-record","recordId":"concentrated:42","projectId":"concentrated","sourceIdentifier":"42","videoId":"cb_42","status":"published","locked":true},
    {"recordType":"normalized-record","recordId":"concentrated:43","projectId":"concentrated","sourceIdentifier":"43","videoId":"cb_43","status":"published","locked":true},
    {"recordType":"normalized-record","recordId":"concentrated:44","projectId":"concentrated","sourceIdentifier":"44","videoId":"cb_44","status":"published","locked":true},
    {"recordType":"normalized-record","recordId":"concentrated:45","projectId":"concentrated","sourceIdentifier":"45","videoId":"cb_45","status":"published","locked":true},
    {"recordType":"normalized-record","recordId":"concentrated:45.5","projectId":"concentrated","sourceIdentifier":"45.5","videoId":"cb_45p5","status":"reserved","locked":false},
    {"recordType":"normalized-record","recordId":"concentrated:46","projectId":"concentrated","sourceIdentifier":"46","videoId":"cb_46","status":"published","locked":true},
    {"recordType":"normalized-record","recordId":"concentrated:47","projectId":"concentrated","sourceIdentifier":"47","videoId":"cb_47","status":"published","locked":true},
    {"recordType":"normalized-record","recordId":"concentrated:48","projectId":"concentrated","sourceIdentifier":"48","videoId":"cb_48","status":"published","locked":true},
    {"recordType":"normalized-record","recordId":"concentrated:49","projectId":"concentrated","sourceIdentifier":"49","videoId":"cb_49","status":"published","locked":true},
    {"recordType":"normalized-record","recordId":"concentrated:50","projectId":"concentrated","sourceIdentifier":"50","videoId":"cb_50","status":"published","locked":true},
    {"recordType":"normalized-record","recordId":"concentrated:50.5","projectId":"concentrated","sourceIdentifier":"50.5","videoId":"cb_50p5","status":"reserved","locked":false},
    {"recordType":"normalized-record","recordId":"concentrated:51","projectId":"concentrated","sourceIdentifier":"51","videoId":"cb_51","status":"published","locked":true},